Datum,Bis,Ort,Details,Organisator,Web
17. Mai 2025,,Rathausplatz Efringen-Kirchen,"Mobilitätstag, Details werden noch bekannt gegeben",Agenda 2030,
Mitte Mai 2025 ,,Verschiedene Orte in der näheren Umgebung,"Architekturführung Holzhäuser, Details werden noch bekannt gegeben",Agenda 2030,
Mitte Mai 2025 ,Anfang Juni,Landkreis Lörrach,Stadtradeln,,
24. Juni 2025,,Alte Schule Efringen-Kirchen,Treffen Agenda 2030 Gruppe; Interessierte sind herzlich eingeladen,Agenda 2030,
30. Sept 2025,,Alte Schule Efringen-Kirchen,Treffen Agenda 2030 Gruppe; Interessierte sind herzlich eingeladen,Agenda 2030,
